{
  "id": "39264a06-fbfc-44c3-a13b-913c6bb01735",
  "slug": "giai-chay-bao-xay-dung-running-2026-vung-buoc-kien-tao-tuong-lai",
  "name": "GIẢI CHẠY BÁO XÂY DỰNG 2026 - VỮNG BƯỚC KIẾN TẠO TƯƠNG LAI",
  "types": [
    "road_run"
  ],
  "date": "2026-06-28",
  "endDate": null,
  "seriesId": null,
  "organizerId": "bao-xay-dung",
  "organizer": "Báo Xây Dựng",
  "edition": null,
  "courses": [],
  "location": {
    "venue": "Phường Vũng Tàu - Thành phố Hồ Chí Minh",
    "city": null
  },
  "geo": {
    "lat": 10.348189,
    "lng": 107.0753349,
    "source": "nominatim",
    "precision": "ward",
    "current": {
      "province": "79",
      "ward": "26506"
    },
    "legacy": {
      "province": "77",
      "district": "747",
      "ward": "26506"
    },
    "access": "road",
    "fromPlaces": {
      "hcmc": {
        "km": 96.2,
        "minutes": 93,
        "method": "road",
        "near": false
      },
      "ha-noi": {
        "km": 1584.9,
        "minutes": 1217,
        "method": "road",
        "near": false
      },
      "da-nang": {
        "km": 901.6,
        "minutes": 689,
        "method": "road",
        "near": false
      },
      "nha-trang": {
        "km": 407.9,
        "minutes": 305,
        "method": "road",
        "near": false
      },
      "da-lat": {
        "km": 328.8,
        "minutes": 245,
        "method": "road",
        "near": false
      },
      "can-tho": {
        "km": 261.7,
        "minutes": 221,
        "method": "road",
        "near": false
      },
      "hai-phong": {
        "km": 1619,
        "minutes": 1244,
        "method": "road",
        "near": false
      },
      "hue": {
        "km": 998.8,
        "minutes": 764,
        "method": "road",
        "near": false
      },
      "vung-tau": {
        "km": 1.7,
        "minutes": 3,
        "method": "road",
        "near": true
      },
      "quy-nhon": {
        "km": 613.8,
        "minutes": 468,
        "method": "road",
        "near": false
      },
      "buon-ma-thuot": {
        "km": 414.1,
        "minutes": 323,
        "method": "road",
        "near": false
      },
      "sa-pa": {
        "km": 1893.4,
        "minutes": 1453,
        "method": "road",
        "near": false
      },
      "ha-long": {
        "km": 1668.7,
        "minutes": 1277,
        "method": "road",
        "near": false
      }
    }
  },
  "prices": [],
  "currency": "VND",
  "registrationStatus": "closed",
  "registrations": [
    {
      "site": "actiup",
      "url": "https://actiup.net/vi/event/giai-chay-bao-xay-dung-running-2026-vung-buoc-kien-tao-tuong-lai"
    }
  ],
  "links": [
    {
      "url": "https://drive.google.com/file/d/1iQer20rYYujGFprci6tcGlX1me_Bnw4i/view",
      "kind": "rules",
      "foundOn": "actiup.net"
    }
  ],
  "flags": [],
  "overrides": {
    "types": {
      "value": [
        "road_run"
      ],
      "reason": "inferred from race name/price-tier text (giải chạy); no source states an explicit type",
      "at": "2026-09-26T13:21:53.036Z"
    }
  },
  "sources": [
    {
      "site": "actiup",
      "role": "seller",
      "url": "https://actiup.net/vi/event/giai-chay-bao-xay-dung-running-2026-vung-buoc-kien-tao-tuong-lai",
      "lastCheckedAt": "2026-09-23T18:31:01.903Z",
      "lastChangedAt": "2026-09-23T18:31:01.903Z",
      "extracted": {
        "facts": {
          "name": "GIẢI CHẠY BÁO XÂY DỰNG 2026 - VỮNG BƯỚC KIẾN TẠO TƯƠNG LAI",
          "date": "2026-06-28",
          "venue": "Phường Vũng Tàu - Thành phố Hồ Chí Minh",
          "organizer": "Báo Xây Dựng",
          "currency": "VND",
          "registrationStatus": "closed",
          "fromPrice": 400000
        },
        "links": [
          {
            "url": "https://drive.google.com/file/d/1iQer20rYYujGFprci6tcGlX1me_Bnw4i/view?usp=drive_link",
            "text": "quy dinh tham du xem tai day"
          }
        ],
        "organizer": {
          "id": "bao-xay-dung",
          "name": "Báo Xây Dựng"
        }
      }
    }
  ],
  "confidence": "single-sourced",
  "createdAt": "2026-09-23T18:32:39.566Z",
  "updatedAt": "2026-09-26T13:21:53.036Z"
}
