{
  "id": "b908ba5a-3cc1-4a32-9e5a-1e4c0be50b60",
  "slug": "test-run-2026-speed-your-pr",
  "name": "TEST RUN 2026 - SPEED YOUR PR",
  "types": [
    "other"
  ],
  "date": "2026-09-27",
  "endDate": null,
  "seriesId": null,
  "organizerId": "nexus-sport-events",
  "organizer": "Nexus Sport Events",
  "edition": null,
  "courses": [],
  "location": {
    "venue": "Công viên SOHO - The Global City, P. Bình Trưng, TP. Hồ Chí Minh",
    "city": null
  },
  "geo": {
    "lat": 10.7887654,
    "lng": 106.7551053,
    "source": "nominatim",
    "precision": "ward",
    "current": {
      "province": "79",
      "ward": "27097"
    },
    "legacy": {
      "province": "79",
      "district": "769",
      "ward": "27091"
    },
    "access": "road",
    "fromPlaces": {
      "hcmc": {
        "km": 8.7,
        "minutes": 10,
        "method": "road",
        "near": true
      },
      "ha-noi": {
        "km": 1497.4,
        "minutes": 1135,
        "method": "road",
        "near": false
      },
      "da-nang": {
        "km": 864.1,
        "minutes": 652,
        "method": "road",
        "near": false
      },
      "nha-trang": {
        "km": 406.8,
        "minutes": 290,
        "method": "road",
        "near": false
      },
      "da-lat": {
        "km": 290.4,
        "minutes": 218,
        "method": "road",
        "near": false
      },
      "can-tho": {
        "km": 178,
        "minutes": 140,
        "method": "road",
        "near": false
      },
      "hai-phong": {
        "km": 1531.6,
        "minutes": 1162,
        "method": "road",
        "near": false
      },
      "hue": {
        "km": 946.8,
        "minutes": 727,
        "method": "road",
        "near": false
      },
      "vung-tau": {
        "km": 89.8,
        "minutes": 81,
        "method": "road",
        "near": false
      },
      "quy-nhon": {
        "km": 612.6,
        "minutes": 453,
        "method": "road",
        "near": false
      },
      "buon-ma-thuot": {
        "km": 360.2,
        "minutes": 264,
        "method": "road",
        "near": false
      },
      "sa-pa": {
        "km": 1806,
        "minutes": 1371,
        "method": "road",
        "near": false
      },
      "ha-long": {
        "km": 1581.3,
        "minutes": 1194,
        "method": "road",
        "near": false
      }
    }
  },
  "prices": [],
  "currency": "VND",
  "registrationStatus": "closed",
  "registrations": [
    {
      "site": "actiup",
      "url": "https://actiup.net/vi/event/test-run-2026-speed-your-pr"
    }
  ],
  "links": [
    {
      "url": "https://drive.google.com/file/d/1Dh60Sea18SQdwY_JniUpKPp5qxNw2cZM/view",
      "kind": "rules",
      "foundOn": "actiup.net"
    }
  ],
  "flags": [],
  "overrides": {},
  "sources": [
    {
      "site": "actiup",
      "role": "seller",
      "url": "https://actiup.net/vi/event/test-run-2026-speed-your-pr",
      "lastCheckedAt": "2026-09-23T18:30:53.472Z",
      "lastChangedAt": "2026-09-23T18:30:53.472Z",
      "extracted": {
        "facts": {
          "name": "TEST RUN 2026 - SPEED YOUR PR",
          "date": "2026-09-27",
          "venue": "Công viên SOHO - The Global City, P. Bình Trưng, TP. Hồ Chí Minh",
          "organizer": "Nexus Sport Events",
          "currency": "VND",
          "registrationStatus": "closed",
          "fromPrice": 99000
        },
        "links": [
          {
            "url": "https://drive.google.com/file/d/1Dh60Sea18SQdwY_JniUpKPp5qxNw2cZM/view?usp=drive_link",
            "text": "quy dinh tham du xem tai day"
          }
        ],
        "organizer": {
          "id": "nexus-sport-events",
          "name": "Nexus Sport Events"
        }
      }
    }
  ],
  "confidence": "single-sourced",
  "createdAt": "2026-09-23T18:32:39.566Z",
  "updatedAt": "2026-09-24T06:49:38.787Z"
}
