{
  "id": "c33c575f-766c-45ba-b38a-8c8d8b69afff",
  "slug": "gia-lai-city-trail-2025-giac-mo-dai-ngan",
  "name": "GIA LAI CITY TRAIL 2025 - GIẤC MƠ ĐẠI NGÀN",
  "types": [
    "city_trail"
  ],
  "date": "2025-11-02",
  "endDate": null,
  "seriesId": "gia-lai-city-trail-giac-mo-dai-ngan",
  "organizerId": "vietrace365",
  "organizer": "VIETRACE365",
  "edition": null,
  "courses": [],
  "location": {
    "venue": "Khu di tích Thắng cảnh Biển Hồ, Đường Tôn Đức Thắng, xã Biển Hồ",
    "city": null
  },
  "geo": {
    "lat": 14.0892083,
    "lng": 108.0376129,
    "source": "nominatim",
    "precision": "province",
    "current": {
      "province": "52",
      "ward": null
    },
    "legacy": null,
    "access": "road",
    "fromPlaces": {
      "hcmc": {
        "km": 396.4,
        "minutes": null,
        "method": "straight_line",
        "near": false
      },
      "ha-noi": {
        "km": 805.6,
        "minutes": null,
        "method": "straight_line",
        "near": false
      },
      "da-nang": {
        "km": 220.2,
        "minutes": null,
        "method": "straight_line",
        "near": false
      },
      "nha-trang": {
        "km": 241,
        "minutes": null,
        "method": "straight_line",
        "near": false
      },
      "da-lat": {
        "km": 242.9,
        "minutes": null,
        "method": "straight_line",
        "near": false
      },
      "can-tho": {
        "km": 513,
        "minutes": null,
        "method": "straight_line",
        "near": false
      },
      "hai-phong": {
        "km": 764.7,
        "minutes": null,
        "method": "straight_line",
        "near": false
      },
      "hue": {
        "km": 268.3,
        "minutes": null,
        "method": "straight_line",
        "near": false
      },
      "vung-tau": {
        "km": 428.9,
        "minutes": null,
        "method": "straight_line",
        "near": false
      },
      "quy-nhon": {
        "km": 132.6,
        "minutes": null,
        "method": "straight_line",
        "near": false
      },
      "buon-ma-thuot": {
        "km": 158.2,
        "minutes": null,
        "method": "straight_line",
        "near": false
      },
      "sa-pa": {
        "km": 1018.2,
        "minutes": null,
        "method": "straight_line",
        "near": false
      },
      "ha-long": {
        "km": 769.8,
        "minutes": null,
        "method": "straight_line",
        "near": false
      }
    }
  },
  "prices": [],
  "currency": "VND",
  "registrationStatus": "closed",
  "registrations": [
    {
      "site": "actiup",
      "url": "https://actiup.net/vi/event/gia-lai-city-trail-2025-giac-mo-dai-ngan"
    }
  ],
  "links": [],
  "flags": [],
  "overrides": {},
  "sources": [
    {
      "site": "actiup",
      "role": "seller",
      "url": "https://actiup.net/vi/event/gia-lai-city-trail-2025-giac-mo-dai-ngan",
      "lastCheckedAt": "2026-09-23T18:31:20.048Z",
      "lastChangedAt": "2026-09-23T18:31:20.048Z",
      "extracted": {
        "facts": {
          "name": "GIA LAI CITY TRAIL 2025 - GIẤC MƠ ĐẠI NGÀN",
          "date": "2025-11-02",
          "venue": "Khu di tích Thắng cảnh Biển Hồ, Đường Tôn Đức Thắng, xã Biển Hồ",
          "organizer": "VIETRACE365",
          "currency": "VND",
          "registrationStatus": "closed",
          "fromPrice": 499000
        },
        "links": [],
        "organizer": {
          "id": "vietrace365",
          "name": "VIETRACE365"
        }
      }
    }
  ],
  "confidence": "single-sourced",
  "createdAt": "2026-09-23T18:32:39.566Z",
  "updatedAt": "2026-09-24T07:11:10.278Z"
}
