{
  "id": "f7b90d61-379d-4113-a25b-1f50ec0f8f2d",
  "slug": "sedona-sky-run-2026",
  "name": "SEDONA SKYRUN 2026",
  "types": [
    "trail_run"
  ],
  "date": "2026-08-09",
  "endDate": null,
  "seriesId": null,
  "organizerId": "nexus-sport-events",
  "organizer": "Nexus Sport Events",
  "edition": null,
  "courses": [],
  "location": {
    "venue": "Tòa nhà Sedona Suites - 67 Lê Lợi, Phường Sài Gòn, Thành phố Hồ Chí Minh.",
    "city": null
  },
  "geo": {
    "lat": 10.7791966,
    "lng": 106.6999282,
    "source": "nominatim",
    "precision": "ward",
    "current": {
      "province": "79",
      "ward": "26740"
    },
    "legacy": {
      "province": "79",
      "district": "760",
      "ward": "26740"
    },
    "access": "road",
    "fromPlaces": {
      "hcmc": {
        "km": 1.7,
        "minutes": 3,
        "method": "road",
        "near": true
      },
      "ha-noi": {
        "km": 1493.8,
        "minutes": 1131,
        "method": "road",
        "near": false
      },
      "da-nang": {
        "km": 860.5,
        "minutes": 649,
        "method": "road",
        "near": false
      },
      "nha-trang": {
        "km": 413.8,
        "minutes": 298,
        "method": "road",
        "near": false
      },
      "da-lat": {
        "km": 297.4,
        "minutes": 226,
        "method": "road",
        "near": false
      },
      "can-tho": {
        "km": 170.6,
        "minutes": 136,
        "method": "road",
        "near": false
      },
      "hai-phong": {
        "km": 1527.9,
        "minutes": 1158,
        "method": "road",
        "near": false
      },
      "hue": {
        "km": 943.2,
        "minutes": 723,
        "method": "road",
        "near": false
      },
      "vung-tau": {
        "km": 96.9,
        "minutes": 89,
        "method": "road",
        "near": false
      },
      "quy-nhon": {
        "km": 619.7,
        "minutes": 460,
        "method": "road",
        "near": false
      },
      "buon-ma-thuot": {
        "km": 356.5,
        "minutes": 261,
        "method": "road",
        "near": false
      },
      "sa-pa": {
        "km": 1802.3,
        "minutes": 1367,
        "method": "road",
        "near": false
      },
      "ha-long": {
        "km": 1577.6,
        "minutes": 1191,
        "method": "road",
        "near": false
      }
    }
  },
  "prices": [],
  "currency": "VND",
  "registrationStatus": "closed",
  "registrations": [
    {
      "site": "actiup",
      "url": "https://actiup.net/vi/event/sedona-sky-run-2026"
    }
  ],
  "links": [
    {
      "url": "https://facebook.com/sedonaskyrun",
      "kind": "facebook",
      "foundOn": "actiup.net"
    },
    {
      "url": "https://drive.google.com/file/d/1yUKDo7ZDfI4wGrSf_PI35QLOU8zQYmTx/view",
      "kind": "rules",
      "foundOn": "actiup.net"
    }
  ],
  "flags": [],
  "overrides": {
    "types": {
      "value": [
        "trail_run"
      ],
      "reason": "inferred from race name/price-tier text (skyrun); no source states an explicit type",
      "at": "2026-09-26T13:21:53.036Z"
    }
  },
  "sources": [
    {
      "site": "actiup",
      "role": "seller",
      "url": "https://actiup.net/vi/event/sedona-sky-run-2026",
      "lastCheckedAt": "2026-09-23T18:30:57.494Z",
      "lastChangedAt": "2026-09-23T18:30:57.494Z",
      "extracted": {
        "facts": {
          "name": "SEDONA SKYRUN 2026",
          "date": "2026-08-09",
          "venue": "Tòa nhà Sedona Suites - 67 Lê Lợi, Phường Sài Gòn, Thành phố Hồ Chí Minh.",
          "organizer": "Nexus Sport Events",
          "currency": "VND",
          "registrationStatus": "closed",
          "fromPrice": 600000
        },
        "links": [
          {
            "url": "https://www.facebook.com/sedonaskyrun",
            "text": "thong tin su kien https www facebook com sedonaskyrun"
          },
          {
            "url": "https://drive.google.com/file/d/1yUKDo7ZDfI4wGrSf_PI35QLOU8zQYmTx/view",
            "text": "quy dinh tham du xem tai day"
          }
        ],
        "organizer": {
          "id": "nexus-sport-events",
          "name": "Nexus Sport Events"
        }
      }
    }
  ],
  "confidence": "single-sourced",
  "createdAt": "2026-09-23T18:32:39.566Z",
  "updatedAt": "2026-09-26T13:21:53.036Z"
}
