{
  "id": "e4278a43-e14b-4e77-ab92-1728d68dc2f1",
  "slug": "ba-den-mountain-international-marathon-2025",
  "name": "BA DEN MOUNTAIN INTERNATIONAL MARATHON 2025",
  "types": [
    "other"
  ],
  "date": "2025-08-02",
  "endDate": "2025-08-03",
  "seriesId": null,
  "organizerId": "nexus-sport-events",
  "organizer": "Nexus Sport Events",
  "edition": null,
  "courses": [],
  "location": {
    "venue": "Quảng trường Khu Du lịch Sun World Bà Đen, Tây Ninh",
    "city": null
  },
  "geo": {
    "lat": 11.0800527,
    "lng": 106.2610531,
    "source": "nominatim",
    "precision": "province",
    "current": {
      "province": "80",
      "ward": null
    },
    "legacy": null,
    "access": "road",
    "fromPlaces": {
      "hcmc": {
        "km": 58.7,
        "minutes": null,
        "method": "straight_line",
        "near": false
      },
      "ha-noi": {
        "km": 1107.1,
        "minutes": null,
        "method": "straight_line",
        "near": false
      },
      "da-nang": {
        "km": 593.2,
        "minutes": null,
        "method": "straight_line",
        "near": false
      },
      "nha-trang": {
        "km": 344.7,
        "minutes": null,
        "method": "straight_line",
        "near": false
      },
      "da-lat": {
        "km": 256.2,
        "minutes": null,
        "method": "straight_line",
        "near": false
      },
      "can-tho": {
        "km": 127.3,
        "minutes": null,
        "method": "straight_line",
        "near": false
      },
      "hai-phong": {
        "km": 1086.8,
        "minutes": null,
        "method": "straight_line",
        "near": false
      },
      "hue": {
        "km": 615.6,
        "minutes": null,
        "method": "straight_line",
        "near": false
      },
      "vung-tau": {
        "km": 121.5,
        "minutes": null,
        "method": "straight_line",
        "near": false
      },
      "quy-nhon": {
        "km": 439.7,
        "minutes": null,
        "method": "straight_line",
        "near": false
      },
      "buon-ma-thuot": {
        "km": 261.7,
        "minutes": null,
        "method": "straight_line",
        "near": false
      },
      "sa-pa": {
        "km": 1277.7,
        "minutes": null,
        "method": "straight_line",
        "near": false
      },
      "ha-long": {
        "km": 1101.2,
        "minutes": null,
        "method": "straight_line",
        "near": false
      }
    }
  },
  "prices": [],
  "currency": "VND",
  "registrationStatus": "closed",
  "registrations": [
    {
      "site": "actiup",
      "url": "https://actiup.net/vi/event/ba-den-mountain-international-marathon-2025"
    }
  ],
  "links": [
    {
      "url": "https://drive.google.com/file/d/19zXNdQUyMgGnNkiCqpniMLNofNmSM0RO/view",
      "kind": "rules",
      "foundOn": "actiup.net"
    }
  ],
  "flags": [],
  "overrides": {},
  "sources": [
    {
      "site": "actiup",
      "role": "seller",
      "url": "https://actiup.net/vi/event/ba-den-mountain-international-marathon-2025",
      "lastCheckedAt": "2026-09-23T18:31:38.908Z",
      "lastChangedAt": "2026-09-23T18:31:38.908Z",
      "extracted": {
        "facts": {
          "name": "BA DEN MOUNTAIN INTERNATIONAL MARATHON 2025",
          "date": "2025-08-02",
          "endDate": "2025-08-03",
          "venue": "Quảng trường Khu Du lịch Sun World Bà Đen, Tây Ninh",
          "organizer": "Nexus Sport Events",
          "currency": "VND",
          "registrationStatus": "closed",
          "fromPrice": 450000
        },
        "links": [
          {
            "url": "https://drive.google.com/file/d/19zXNdQUyMgGnNkiCqpniMLNofNmSM0RO/view?usp=sharing",
            "text": "quy dinh tham du xem tai day"
          }
        ],
        "organizer": {
          "id": "nexus-sport-events",
          "name": "Nexus Sport Events"
        }
      }
    }
  ],
  "confidence": "single-sourced",
  "createdAt": "2026-09-23T18:32:39.566Z",
  "updatedAt": "2026-09-24T07:11:10.278Z"
}
