{
  "id": "dec39656-21e8-4986-a481-8f9a6371afa7",
  "slug": "dalat-music-night-run-2024",
  "name": "Đà Lạt Music Night Run 2024",
  "types": [
    "road_run"
  ],
  "date": "2024-05-31",
  "endDate": "2024-06-01",
  "seriesId": "dalat-music-night-run",
  "organizerId": "nexus-sport-events",
  "organizer": "Nexus Sport Events",
  "edition": null,
  "courses": [],
  "location": {
    "venue": "Đà Lạt, Lâm Đồng, Việt Nam",
    "city": null
  },
  "geo": {
    "lat": 11.9082632,
    "lng": 108.4572089,
    "source": "nominatim",
    "precision": "venue",
    "current": {
      "province": "68",
      "ward": "24781"
    },
    "legacy": {
      "province": "68",
      "district": "672",
      "ward": "24802"
    },
    "access": "road",
    "fromPlaces": {
      "hcmc": {
        "km": 290.3,
        "minutes": 222,
        "method": "road",
        "near": false
      },
      "ha-noi": {
        "km": 1403.2,
        "minutes": 1118,
        "method": "road",
        "near": false
      },
      "da-nang": {
        "km": 633.7,
        "minutes": 515,
        "method": "road",
        "near": false
      },
      "nha-trang": {
        "km": 140,
        "minutes": 132,
        "method": "road",
        "near": false
      },
      "da-lat": {
        "km": 8.4,
        "minutes": 7,
        "method": "road",
        "near": true
      },
      "can-tho": {
        "km": 455.8,
        "minutes": 350,
        "method": "road",
        "near": false
      },
      "hai-phong": {
        "km": 1437.3,
        "minutes": 1145,
        "method": "road",
        "near": false
      },
      "hue": {
        "km": 730.9,
        "minutes": 590,
        "method": "road",
        "near": false
      },
      "vung-tau": {
        "km": 319.7,
        "minutes": 237,
        "method": "road",
        "near": false
      },
      "quy-nhon": {
        "km": 345.9,
        "minutes": 294,
        "method": "road",
        "near": false
      },
      "buon-ma-thuot": {
        "km": 207,
        "minutes": 179,
        "method": "road",
        "near": false
      },
      "sa-pa": {
        "km": 1711.7,
        "minutes": 1354,
        "method": "road",
        "near": false
      },
      "ha-long": {
        "km": 1487,
        "minutes": 1178,
        "method": "road",
        "near": false
      }
    }
  },
  "prices": [],
  "currency": "VND",
  "registrationStatus": "closed",
  "registrations": [
    {
      "site": "actiup",
      "url": "https://actiup.net/vi/event/dalat-music-night-run-2024"
    }
  ],
  "links": [
    {
      "url": "https://dalat.musicrun.vn/quy-dinh-dieu-le",
      "kind": "rules",
      "foundOn": "actiup.net"
    }
  ],
  "flags": [],
  "overrides": {
    "types": {
      "value": [
        "road_run"
      ],
      "reason": "inferred from race name/price-tier text (run); no source states an explicit type",
      "at": "2026-09-26T13:21:53.036Z"
    }
  },
  "sources": [
    {
      "site": "actiup",
      "role": "seller",
      "url": "https://actiup.net/vi/event/dalat-music-night-run-2024",
      "lastCheckedAt": "2026-09-23T18:32:31.132Z",
      "lastChangedAt": "2026-09-23T18:32:31.132Z",
      "extracted": {
        "facts": {
          "name": "Đà Lạt Music Night Run 2024",
          "date": "2024-05-31",
          "endDate": "2024-06-01",
          "venue": "Đà Lạt, Lâm Đồng, Việt Nam",
          "organizer": "Nexus Sport Events",
          "registrationStatus": "closed",
          "fromPrice": 350000
        },
        "links": [
          {
            "url": "https://dalat.musicrun.vn/quy-dinh-dieu-le/",
            "text": "quy dinh tham du xem tai day"
          }
        ],
        "organizer": {
          "id": "nexus-sport-events",
          "name": "Nexus Sport Events"
        }
      }
    }
  ],
  "confidence": "single-sourced",
  "createdAt": "2026-09-23T18:32:39.566Z",
  "updatedAt": "2026-09-26T13:21:53.036Z"
}
